{
  "schemaVersion": 1,
  "game": "shape-packing-2d",
  "catalogId": "shape-studio",
  "catalogRevision": 5,
  "engineVersion": "1.0.0",
  "coordinateSystem": "xy-zero-based",
  "pieceSets": [
    {
      "id": "studio-rectangle",
      "version": 1,
      "allowRotations": true,
      "allowReflections": false,
      "pieces": [
        {
          "id": "A",
          "symbol": "A",
          "color": "#849979",
          "cells": [
            [
              0,
              0
            ],
            [
              1,
              0
            ]
          ]
        },
        {
          "id": "B",
          "symbol": "B",
          "color": "#d4a05c",
          "cells": [
            [
              0,
              0
            ],
            [
              1,
              0
            ],
            [
              1,
              1
            ]
          ]
        },
        {
          "id": "C",
          "symbol": "C",
          "color": "#a18eb3",
          "cells": [
            [
              0,
              0
            ],
            [
              1,
              0
            ],
            [
              1,
              1
            ],
            [
              2,
              1
            ]
          ]
        },
        {
          "id": "D",
          "symbol": "D",
          "color": "#cb7d69",
          "cells": [
            [
              0,
              0
            ],
            [
              1,
              0
            ],
            [
              0,
              1
            ],
            [
              1,
              1
            ],
            [
              2,
              1
            ]
          ]
        },
        {
          "id": "E",
          "symbol": "E",
          "color": "#729da9",
          "cells": [
            [
              0,
              0
            ],
            [
              1,
              0
            ],
            [
              2,
              0
            ],
            [
              3,
              0
            ],
            [
              0,
              1
            ],
            [
              1,
              1
            ],
            [
              0,
              2
            ]
          ]
        },
        {
          "id": "F",
          "symbol": "F",
          "color": "#c4b45f",
          "cells": [
            [
              0,
              0
            ],
            [
              1,
              0
            ],
            [
              0,
              1
            ],
            [
              1,
              1
            ],
            [
              0,
              2
            ],
            [
              1,
              2
            ],
            [
              0,
              3
            ],
            [
              1,
              3
            ],
            [
              1,
              4
            ]
          ]
        }
      ]
    },
    {
      "id": "studio-cat",
      "version": 1,
      "allowRotations": true,
      "allowReflections": false,
      "pieces": [
        {
          "id": "A",
          "symbol": "A",
          "color": "#849979",
          "cells": [
            [
              0,
              0
            ],
            [
              0,
              1
            ]
          ]
        },
        {
          "id": "B",
          "symbol": "B",
          "color": "#d4a05c",
          "cells": [
            [
              0,
              0
            ],
            [
              0,
              1
            ],
            [
              1,
              1
            ]
          ]
        },
        {
          "id": "C",
          "symbol": "C",
          "color": "#a18eb3",
          "cells": [
            [
              1,
              0
            ],
            [
              0,
              1
            ],
            [
              1,
              1
            ],
            [
              1,
              2
            ]
          ]
        },
        {
          "id": "D",
          "symbol": "D",
          "color": "#cb7d69",
          "cells": [
            [
              2,
              0
            ],
            [
              0,
              1
            ],
            [
              1,
              1
            ],
            [
              2,
              1
            ],
            [
              1,
              2
            ]
          ]
        },
        {
          "id": "E",
          "symbol": "E",
          "color": "#729da9",
          "cells": [
            [
              2,
              0
            ],
            [
              0,
              1
            ],
            [
              1,
              1
            ],
            [
              2,
              1
            ],
            [
              1,
              2
            ],
            [
              2,
              2
            ],
            [
              1,
              3
            ]
          ]
        },
        {
          "id": "F",
          "symbol": "F",
          "color": "#c4b45f",
          "cells": [
            [
              2,
              0
            ],
            [
              3,
              0
            ],
            [
              0,
              1
            ],
            [
              1,
              1
            ],
            [
              2,
              1
            ],
            [
              0,
              2
            ],
            [
              1,
              2
            ],
            [
              2,
              2
            ],
            [
              3,
              2
            ]
          ]
        }
      ]
    },
    {
      "id": "studio-dog",
      "version": 1,
      "allowRotations": true,
      "allowReflections": false,
      "pieces": [
        {
          "id": "A",
          "symbol": "A",
          "color": "#849979",
          "cells": [
            [
              0,
              0
            ],
            [
              0,
              1
            ]
          ]
        },
        {
          "id": "B",
          "symbol": "B",
          "color": "#d4a05c",
          "cells": [
            [
              0,
              0
            ],
            [
              0,
              1
            ],
            [
              1,
              1
            ]
          ]
        },
        {
          "id": "C",
          "symbol": "C",
          "color": "#a18eb3",
          "cells": [
            [
              1,
              0
            ],
            [
              0,
              1
            ],
            [
              1,
              1
            ],
            [
              0,
              2
            ]
          ]
        },
        {
          "id": "D",
          "symbol": "D",
          "color": "#cb7d69",
          "cells": [
            [
              0,
              0
            ],
            [
              1,
              0
            ],
            [
              2,
              0
            ],
            [
              0,
              1
            ],
            [
              1,
              1
            ]
          ]
        },
        {
          "id": "E",
          "symbol": "E",
          "color": "#729da9",
          "cells": [
            [
              1,
              0
            ],
            [
              2,
              0
            ],
            [
              0,
              1
            ],
            [
              1,
              1
            ],
            [
              2,
              1
            ],
            [
              0,
              2
            ],
            [
              1,
              2
            ]
          ]
        },
        {
          "id": "F",
          "symbol": "F",
          "color": "#c4b45f",
          "cells": [
            [
              5,
              0
            ],
            [
              1,
              1
            ],
            [
              2,
              1
            ],
            [
              3,
              1
            ],
            [
              4,
              1
            ],
            [
              5,
              1
            ],
            [
              0,
              2
            ],
            [
              1,
              2
            ],
            [
              2,
              2
            ],
            [
              3,
              2
            ],
            [
              2,
              3
            ]
          ]
        }
      ]
    },
    {
      "id": "studio-heart",
      "version": 1,
      "allowRotations": true,
      "allowReflections": false,
      "pieces": [
        {
          "id": "A",
          "symbol": "A",
          "color": "#849979",
          "cells": [
            [
              0,
              0
            ],
            [
              0,
              1
            ]
          ]
        },
        {
          "id": "B",
          "symbol": "B",
          "color": "#d4a05c",
          "cells": [
            [
              0,
              0
            ],
            [
              0,
              1
            ],
            [
              1,
              1
            ]
          ]
        },
        {
          "id": "C",
          "symbol": "C",
          "color": "#a18eb3",
          "cells": [
            [
              0,
              0
            ],
            [
              1,
              0
            ],
            [
              1,
              1
            ],
            [
              1,
              2
            ]
          ]
        },
        {
          "id": "D",
          "symbol": "D",
          "color": "#cb7d69",
          "cells": [
            [
              1,
              0
            ],
            [
              1,
              1
            ],
            [